{"acceptance_contract":{"path":"artifacts/session11/real_use/httpx/acceptance_contract.v1.public.json","sha256":"sha256:c9caae41b31e41de2616f9831368131233d7866d3bc9dfb42f400276a1b4726f"},"attestation":{"path":"artifacts/session11/real_use/httpx/acceptance_attestation.v1.public.json","sha256":"sha256:5817eca100d73a45adfd88e93fc30080860d2bd296ede70c0715741d5b81c650"},"brief":{"path":"artifacts/session11/real_use/httpx/change_brief.v1.public.json","sha256":"sha256:2f15d7c4775588b9acd2dd9c969ff9b4ad86e9e3b0100e3aad5e4eaaf87cc143"},"candidate":{"base":"ca097c96f97d8d2a5da09b8ca736c7e78a2467f6","candidate_digest":"sha256:5dff6f7c79e6be1132c51fbba908efc68db902a762f224332fd204eaebf5327f","head":"4b9f63e507c4ea75fa59f6bbdfb103e2f014a6f9","mode":"immutable","repository_identity":"https://github.com/encode/httpx"},"candidate_freeze":{"path":"artifacts/session11/real_use/httpx/candidate_freeze.v1.public.json","sha256":"sha256:32f7937db9956c901b02075fde57c11cd54e4fb3739be9cc4d72751866ee033a"},"claim_registry":{"path":"artifacts/session11/claim_registry.v1.public.json","sha256":"sha256:0ead7bf736f100a930a60ec8bbeca0090f993d7fdd6a49e552a0aea7c4fa6cf8"},"claim_registry_digest":"sha256:0ead7bf736f100a930a60ec8bbeca0090f993d7fdd6a49e552a0aea7c4fa6cf8","closure_requirements":[{"id":"880f3f1d-f9ec-45ea-b78b-bf9289edf89a","path":"artifacts/session11/real_use/httpx/closure_requirements/880f3f1d-f9ec-45ea-b78b-bf9289edf89a.v1.public.json","sha256":"sha256:3ad379e6f4faddfc822e4af47d368efcdca175c9ba78827cb19cbeebb7a00df1"},{"id":"cd7e4ec5-6d4b-4af3-9f46-1a6096c3c026","path":"artifacts/session11/real_use/httpx/closure_requirements/cd7e4ec5-6d4b-4af3-9f46-1a6096c3c026.v1.public.json","sha256":"sha256:4b101cf481a806cde673f1c7b5d4bce3ad1c856b9b110b1cbcaa155269424c90"}],"evidence_policy":{"challenge_available":false,"execution_available":false,"target_access":"read_only","trusted_imports":"inherited_qualification_only"},"evidence_settlement":{"path":"artifacts/session11/real_use/httpx/evidence_settlement.v1.public.json","sha256":"sha256:c5815ece0acd6c917949ec7f8cbab145777fd103c1beb84efed3f9243d10be58"},"implementation_binding":{"claim_registry_digest":"sha256:0ead7bf736f100a930a60ec8bbeca0090f993d7fdd6a49e552a0aea7c4fa6cf8","extension_api_major":1,"implementation_commit":"22d18fad59b12780c059ff1eb1e78844bfdf884d","implementation_tree":"d32299364f9d964e8cc031912f54f3f3b923d755","maturity":"QUALIFIED_BOUNDED","package_version":"0.4.0","published":false,"schema_id":"provan.session11_implementation_binding.v1","schema_registry_digest":"sha256:4883f894956a1a6c20135138a529c416ebd10004eea8931808a830054ff43758","wheel_sha256":"sha256:e250c509d1676ebb9f1ec066059b3eb770a12a3804666c22a1e65bfad6d89d4f"},"implementation_binding_ref":{"path":"artifacts/session11/successor_closeout/implementation_binding.v1.public.json","sha256":"sha256:f44be2dc2db59fcc8161298f5b1cc6aa9b6463a201873c1079d1d2eb9556f449"},"layer4_matrix":{"path":"artifacts/session11/layer4_claim_matrix.v1.public.json","sha256":"sha256:2170aa1587fe24c1fdc2b161425d38277ef7659eeb65d9458e0d1b4761a2ed23"},"limitations":["SESSION12_QUALIFIED_VERIFIER_UNAVAILABLE","SESSION13_CHALLENGE_NOT_IMPLEMENTED","DYNAMIC_SURFACES_NONCOVERAGE"],"preparation":{"path":"artifacts/session11/real_use/httpx/acceptance_preparation.v1.public.json","sha256":"sha256:33ee846bc79151173a21f57ebe7e57f2f895df763d508531898a1d0bc8ff7355"},"projection_rules":{"client_safe":"DETERMINISTICALLY_SANITISED","internal":"LOCAL_NON_PUBLIC","record_locator":"RESOLVE_CANONICAL_CHAIN_NOT_RENDERED_PROSE"},"proof_manifest":{"path":"artifacts/session11/proofs/handoff_evidence_manifest.v1.public.json","sha256":"sha256:0e08f5bc8e304bd4438cc5f8cfc64508089c2e7d1908bdb41495c28d548fc7f7"},"proof_root":"sha256:727cde9a306a7bffe469c8c71997774422058d5df9e95d856f31a0b899a540e2","protected_invariants":[],"receipt_contracts":[{"path":"provan/schemas/environment-receipt.v1.json","sha256":"sha256:3af5991fdd66fe6a22a8ca4977ed81a5009a0ab8eaef7d1c3aaee490a70ee7cc"},{"path":"provan/schemas/command-receipt.v1.json","sha256":"sha256:1daeb5e3fc7405b17d8043a2e40fe1bcaf20afb5dcca131e3eafe7014a102487"}],"reinspection":{"path":"artifacts/session11/real_use/reinspection_qualification.v1.public.json","sha256":"sha256:b1e8a9b482dae6e97b20d55c82aec73e650c4b2329602f25ec0937d6fcbc0194"},"reviewer_receipts":[],"schema_id":"provan.session12_handoff.v1","schema_registry":{"path":"artifacts/session11/schema_registry.v1.public.json","sha256":"sha256:9b917f86c55a41d774ea1407ac15afab8c60de476846fa96790fa282c0751904"},"seed_dispositions":[{"id":"d933f954-02ff-4eba-a7a1-dee9244ea29f","path":"artifacts/session11/real_use/httpx/seed_dispositions/d933f954-02ff-4eba-a7a1-dee9244ea29f.v1.public.json","sha256":"sha256:8a9991ac0b2f2d89451e31ecdbfd64d4e6b59b4fb8e127f8b21742f7fa80a4b7"},{"id":"98585c8d-368a-4242-aacf-8b668d5891aa","path":"artifacts/session11/real_use/httpx/seed_dispositions/98585c8d-368a-4242-aacf-8b668d5891aa.v1.public.json","sha256":"sha256:358b1c1c241fdb7910cfafe20f625645856abbbb9db84ed255291fed09515d3d"}],"session12_prerequisites":["consume exact contract and freeze digests","qualify producer and environment independently","preserve read-only target policy","execute only typed verifier work orders","return content-addressed receipts","do not redesign closure or invariant semantics"],"verifier_contracts":[{"path":"provan/schemas/verifier-work-order.v1.json","sha256":"sha256:653c7e7c1eb6b4f49abc2d860db5f2fb2ba2dc7f9171ce113cdcf2042fbaee23"},{"path":"provan/schemas/verifier-capability-request.v1.json","sha256":"sha256:f1692cacd5e40457b14d014ddf0c140cc5c61f64317a4f097f6b1aaab9007fa0"},{"path":"provan/schemas/verification-result.v1.json","sha256":"sha256:568289a27119f69cf23de7c768b7e0d9c38dcb6ab938e1b215da0434dab900cf"}],"wheel":{"path":"dist/provan_assurance-0.4.0-py3-none-any.whl","sha256":"sha256:e250c509d1676ebb9f1ec066059b3eb770a12a3804666c22a1e65bfad6d89d4f"}}
